# lspci -xxx -D
0000:00:00.0 Host bridge: Intel Corporation Xeon E3-1200 v6/7th Gen Core Processor Host Bridge/DRAM Registers (rev 02)
00: 86 80 04 59 06 00 90 20 02 00 00 06 00 00 00 00
10: 00 00 00 00 00 00 00 00 00 00 00 00 00 00 00 00
20: 00 00 00 00 00 00 00 00 00 00 00 00 86 80 15 20
30: 00 00 00 00 e0 00 00 00 00 00 00 00 00 00 00 00
40: 01 90 d1 fe 00 00 00 00 01 00 d1 fe 00 00 00 00
50: c1 01 00 00 31 00 00 00 47 00 f0 bf 01 00 40 bd
60: 01 00 00 e0 00 00 00 00 01 80 d1 fe 00 00 00 00
70: 00 00 00 ff 01 00 00 00 00 0c 00 ff 7f 00 00 00
80: 11 11 11 11 11 11 11 00 1a 00 00 00 00 00 00 00
90: 01 00 00 ff 01 00 00 00 01 00 f0 3e 02 00 00 00
a0: 01 00 00 00 02 00 00 00 01 00 00 3f 02 00 00 00
b0: 01 00 00 be 01 00 80 bd 01 00 40 bd 01 00 00 c0
c0: 00 00 00 00 00 00 00 00 00 00 00 00 00 00 00 00
d0: 00 00 00 00 00 00 00 00 00 00 00 00 00 00 00 00
e0: 09 00 10 01 21 60 61 7a dc 80 15 14 00 c0 06 00
f0: 00 00 00 00 c8 0f 09 00 00 00 00 00 00 00 00 00

0000:00:02.0 VGA compatible controller: Intel Corporation Kaby Lake-U GT2 [HD Graphics 620] (rev 02)
00: 86 80 16 59 07 04 10 00 02 00 00 03 10 00 00 00
10: 04 00 00 de 00 00 00 00 0c 00 00 c0 00 00 00 00
20: 01 f0 00 00 00 00 00 00 00 00 00 00 86 80 12 22
30: 00 00 00 00 40 00 00 00 00 00 00 00 0b 01 00 00
40: 09 70 0c 01 21 60 61 7a dc 80 15 14 00 00 00 00
50: c1 01 00 00 31 00 00 00 00 00 00 00 01 00 00 be
60: 00 00 01 00 00 00 00 00 00 00 00 00 00 00 00 00
70: 10 ac 92 00 00 80 00 10 00 00 00 00 00 00 00 00
80: 00 00 00 00 00 00 00 00 00 00 00 00 00 00 00 00
90: 00 00 00 00 00 00 00 00 00 00 00 00 00 00 00 00
a0: 00 00 00 00 00 00 00 00 00 00 00 00 05 d0 01 00
b0: 18 00 e0 fe 00 00 00 00 00 00 00 00 00 00 00 00
c0: 00 00 00 00 00 00 00 00 00 00 00 00 00 00 00 00
d0: 01 00 22 00 00 00 00 00 00 00 00 00 00 00 00 00
e0: 00 00 00 00 00 00 00 00 00 80 00 00 00 00 00 00
f0: 00 00 00 00 00 00 00 00 00 00 00 00 18 10 fb bc

0000:00:14.0 USB controller: Intel Corporation Sunrise Point-LP USB 3.0 xHCI Controller (rev 21)
00: 86 80 2f 9d 06 04 90 02 21 30 03 0c 00 00 80 00
10: 04 00 21 df 00 00 00 00 00 00 00 00 00 00 00 00
20: 00 00 00 00 00 00 00 00 00 00 00 00 86 80 70 72
30: 00 00 00 00 70 00 00 00 00 00 00 00 0b 01 00 00
40: fd 01 34 80 88 c6 0f 80 00 00 00 00 00 00 00 00
50: 5b 6e ce 0f 00 00 00 00 00 00 00 00 00 00 00 00
60: 30 60 00 00 00 00 00 00 00 00 00 00 00 00 00 00
70: 01 80 c2 c1 08 00 00 00 00 00 00 00 00 00 00 00
80: 05 00 b7 00 18 03 e0 fe 00 00 00 00 00 00 00 00
90: 09 00 14 f0 10 00 40 01 00 00 00 00 c1 0a 08 00
a0: 00 08 00 00 00 18 00 00 8f 40 02 00 00 01 04 00
b0: 01 00 00 00 08 00 00 00 62 00 00 00 00 00 00 00
c0: 00 00 00 00 00 00 00 00 00 00 00 00 00 00 00 00
d0: 01 00 00 00 08 00 00 00 10 00 00 00 00 00 00 00
e0: 00 00 00 00 00 00 00 00 00 00 00 00 00 00 00 00
f0: 00 00 00 00 00 00 00 00 b3 0f 41 08 00 00 00 00

0000:00:14.2 Signal processing controller: Intel Corporation Sunrise Point-LP Thermal subsystem (rev 21)
00: 86 80 31 9d 02 00 10 00 21 00 80 11 00 00 00 00
10: 04 e0 22 df 00 00 00 00 00 00 00 00 00 00 00 00
20: 00 00 00 00 00 00 00 00 00 00 00 00 86 80 70 72
30: 00 00 00 00 50 00 00 00 00 00 00 00 0b 03 00 00
40: 04 00 00 00 00 00 00 00 00 00 00 00 00 00 00 00
50: 01 80 23 00 08 00 00 00 00 00 00 00 00 00 00 00
60: 00 00 00 00 00 00 00 00 00 00 00 00 00 00 00 00
70: 00 00 00 00 00 00 00 00 00 00 00 00 00 00 00 00
80: 05 00 00 00 00 00 00 00 00 00 00 00 00 00 00 00
90: 00 00 00 00 00 00 00 00 00 00 00 00 00 00 00 00
a0: 00 00 00 00 00 00 00 00 00 00 00 00 00 00 00 00
b0: 00 00 00 00 00 00 00 00 00 00 00 00 00 00 00 00
c0: 00 00 00 00 00 00 00 00 00 00 00 00 00 00 00 00
d0: 00 00 00 00 00 00 00 00 00 00 00 00 00 00 00 00
e0: 00 00 00 00 00 00 00 00 00 00 00 00 00 00 00 00
f0: 00 00 00 00 00 00 00 00 b3 0f 41 08 00 00 00 00

0000:00:16.0 Communication controller: Intel Corporation Sunrise Point-LP CSME HECI #1 (rev 21)
00: 86 80 3a 9d 06 04 10 00 21 00 80 07 00 00 80 00
10: 04 d0 22 df 00 00 00 00 00 00 00 00 00 00 00 00
20: 00 00 00 00 00 00 00 00 00 00 00 00 86 80 99 19
30: 00 00 00 00 50 00 00 00 00 00 00 00 0b 01 00 00
40: 45 02 00 90 10 00 01 80 06 05 21 80 00 00 00 00
50: 01 8c 03 40 08 00 00 00 00 00 00 00 00 00 00 00
60: 20 00 00 00 00 40 08 00 00 00 00 00 00 00 00 c0
70: 00 00 00 00 00 00 00 00 00 00 00 00 00 00 00 00
80: 00 00 00 00 00 00 00 00 00 00 00 00 05 00 81 00
90: b8 02 e0 fe 00 00 00 00 00 00 00 00 00 00 00 00
a0: 00 00 00 00 00 00 00 00 00 00 00 00 00 00 00 00
b0: 00 00 00 00 00 00 00 00 00 00 00 00 00 00 00 40
c0: 00 00 00 00 00 00 00 00 00 00 00 00 00 00 00 00
d0: 00 00 00 00 00 00 00 00 00 00 00 00 00 00 00 00
e0: 00 00 00 00 00 00 00 00 00 00 00 00 00 00 00 00
f0: 00 00 00 00 00 00 00 00 b3 0f 41 08 00 00 00 00

0000:00:17.0 SATA controller: Intel Corporation Sunrise Point-LP SATA Controller [AHCI mode] (rev 21)
00: 86 80 03 9d 07 04 b0 02 21 01 06 01 00 00 00 00
10: 00 80 22 df 00 c0 22 df 91 f0 00 00 81 f0 00 00
20: 61 f0 00 00 00 b0 22 df 00 00 00 00 86 80 70 72
30: 00 00 00 00 80 00 00 00 00 00 00 00 0b 01 00 00
40: 00 00 00 00 00 00 00 00 00 00 00 00 00 00 00 00
50: 00 00 00 00 00 00 00 00 00 00 00 00 00 00 00 00
60: 00 00 00 00 00 00 00 00 00 00 00 00 00 00 00 00
70: 01 a8 03 40 08 00 00 00 00 00 00 00 00 00 00 00
80: 05 70 01 00 78 02 e0 fe 00 00 00 00 00 00 00 00
90: 00 06 01 81 83 01 00 00 24 02 dc 20 30 00 00 80
a0: a4 00 00 00 00 00 00 00 12 00 10 00 48 00 00 00
b0: 00 00 00 00 00 00 00 00 00 00 00 00 00 00 00 00
c0: 00 00 00 00 00 00 00 00 00 00 00 00 00 00 00 00
d0: 11 00 00 00 00 00 00 00 01 00 00 00 00 00 00 00
e0: 00 00 00 00 00 00 00 00 00 00 00 00 00 00 00 00
f0: 00 00 00 00 00 00 00 00 b3 0f 41 08 00 00 00 00

0000:00:1c.0 PCI bridge: Intel Corporation Sunrise Point-LP PCI Express Root Port #3 (rev f1)
00: 86 80 12 9d 07 04 10 00 f1 00 04 06 10 00 81 00
10: 00 00 00 00 00 00 00 00 00 01 01 00 e0 e0 00 00
20: 10 df 10 df f1 ff 01 00 00 00 00 00 00 00 00 00
30: 00 00 00 00 40 00 00 00 00 00 00 00 0b 03 12 00
40: 10 80 42 01 01 80 00 00 0f 00 10 00 13 40 72 03
50: 40 0c 11 30 00 b2 34 00 00 00 40 01 08 00 00 00
60: 00 00 00 00 37 08 00 00 00 04 00 00 0e 00 00 00
70: 03 00 01 00 00 00 00 00 00 00 00 00 00 00 00 00
80: 05 90 01 00 18 02 e0 fe 00 00 00 00 00 00 00 00
90: 0d a0 00 00 86 80 70 72 00 00 00 00 00 00 00 00
a0: 01 00 03 c8 00 00 00 00 00 00 00 00 00 00 00 00
b0: 00 00 00 00 00 00 00 00 00 00 00 00 00 00 00 00
c0: 00 00 00 00 00 00 00 00 00 00 00 00 00 00 00 00
d0: 01 10 00 07 42 18 00 00 08 00 9e 09 00 00 00 00
e0: 00 03 e3 00 00 00 00 00 06 00 10 00 00 00 00 00
f0: 50 01 00 00 00 00 00 4c b3 0f 41 08 04 00 00 03

0000:00:1c.4 PCI bridge: Intel Corporation Sunrise Point-LP PCI Express Root Port #5 (rev f1)
00: 86 80 14 9d 07 04 10 00 f1 00 04 06 10 00 81 00
10: 00 00 00 00 00 00 00 00 00 02 02 00 d0 d0 00 00
20: 00 df 00 df f1 ff 01 00 00 00 00 00 00 00 00 00
30: 00 00 00 00 40 00 00 00 00 00 00 00 0b 01 12 00
40: 10 80 42 01 01 80 00 00 0f 00 10 00 13 40 72 05
50: 40 0c 11 30 00 b2 44 00 00 00 40 01 08 00 00 00
60: 00 00 00 00 37 08 00 00 00 04 00 00 0e 00 00 00
70: 03 00 01 00 00 00 00 00 00 00 00 00 00 00 00 00
80: 05 90 01 00 58 02 e0 fe 00 00 00 00 00 00 00 00
90: 0d a0 00 00 86 80 70 72 00 00 00 00 00 00 00 00
a0: 01 00 03 c8 00 00 00 00 00 00 00 00 00 00 00 00
b0: 00 00 00 00 00 00 00 00 00 00 00 00 00 00 00 00
c0: 00 00 00 00 00 00 00 00 00 00 00 00 00 00 00 00
d0: 01 10 00 07 42 18 00 00 08 00 9e 09 00 00 00 00
e0: 00 f7 f3 00 00 00 00 00 16 80 12 00 00 00 00 00
f0: 50 01 00 00 00 03 00 40 b3 0f 41 08 04 00 00 01

0000:00:1f.0 ISA bridge: Intel Corporation Sunrise Point LPC/eSPI Controller (rev 21)
00: 86 80 4e 9d 07 00 00 02 21 00 01 06 00 00 80 00
10: 00 00 00 00 00 00 00 00 00 00 00 00 00 00 00 00
20: 00 00 00 00 00 00 00 00 00 00 00 00 86 80 70 72
30: 00 00 00 00 00 00 00 00 00 00 00 00 00 00 00 00
40: 00 00 00 00 00 00 00 00 00 00 00 00 00 00 00 00
50: 00 00 00 00 00 00 00 00 00 00 00 00 00 00 00 00
60: 00 00 00 00 d0 00 00 00 00 00 00 00 00 00 00 00
70: 00 00 00 00 00 00 00 00 00 00 00 00 00 00 00 00
80: 00 00 00 14 01 0a 3c 00 81 00 0c 00 00 00 00 00
90: 00 00 00 00 00 04 00 00 00 00 00 00 00 00 00 00
a0: 00 00 00 00 00 00 00 00 00 00 00 00 00 00 00 00
b0: 00 00 00 00 00 00 00 00 00 00 00 00 00 00 00 00
c0: 00 00 00 00 00 00 00 00 00 00 00 00 00 00 00 00
d0: 33 22 11 00 67 45 00 00 cf ff 00 00 80 00 00 00
e0: c1 00 00 00 00 00 00 00 00 00 00 00 00 00 00 00
f0: 00 00 00 00 00 00 00 00 b3 0f 41 08 00 00 00 00

0000:00:1f.2 Memory controller: Intel Corporation Sunrise Point-LP PMC (rev 21)
00: 86 80 21 9d 00 00 00 00 21 00 80 05 00 00 80 00
10: 00 40 22 df 00 00 00 00 00 00 00 00 00 00 00 00
20: 00 00 00 00 00 00 00 00 00 00 00 00 86 80 70 72
30: 00 00 00 00 00 00 00 00 00 00 00 00 00 00 00 00
40: 01 18 00 00 80 01 00 00 00 00 00 fe 00 00 00 00
50: 00 00 00 00 00 00 00 00 00 00 00 00 00 00 00 00
60: 00 00 00 00 00 00 00 00 00 00 00 00 00 00 00 00
70: 00 00 00 00 00 00 00 00 00 00 00 00 00 00 00 00
80: 00 00 00 00 00 00 00 00 00 00 00 00 00 00 00 00
90: 00 00 00 00 00 00 00 00 00 00 00 00 00 00 00 00
a0: f8 36 80 d8 09 3a 07 00 00 46 00 00 00 00 00 81
b0: 00 00 00 00 00 00 00 00 00 00 00 00 00 00 00 00
c0: 00 00 00 00 00 00 00 00 00 00 00 00 00 00 00 00
d0: 00 00 00 00 00 00 00 00 00 00 00 00 00 00 00 00
e0: 00 00 00 00 00 00 00 00 00 00 00 00 00 00 00 00
f0: 00 00 00 00 00 00 00 00 b3 0f 41 08 00 00 00 00

0000:00:1f.3 Audio device: Intel Corporation Sunrise Point-LP HD Audio (rev 21)
00: 86 80 71 9d 06 04 10 00 21 00 03 04 10 20 00 00
10: 04 00 22 df 00 00 00 00 00 00 00 00 00 00 00 00
20: 04 00 20 df 00 00 00 00 00 00 00 00 86 80 70 72
30: 00 00 00 00 50 00 00 00 00 00 00 00 0b 01 00 00
40: 00 00 00 00 00 00 00 00 ff 0d 3b 80 00 00 00 00
50: 01 60 43 c0 08 00 00 00 00 00 00 00 00 00 00 00
60: 05 00 81 00 f8 02 e0 fe 00 00 00 00 00 00 00 00
70: 10 00 91 00 00 00 00 10 00 20 10 00 00 00 00 00
80: 00 00 00 00 00 00 00 00 00 00 00 00 00 00 00 00
90: 00 00 00 00 00 00 00 00 00 00 00 00 00 00 00 00
a0: 00 00 00 00 00 00 00 00 00 00 00 00 00 00 00 00
b0: 00 00 00 00 00 00 00 00 00 00 00 00 00 00 00 00
c0: 08 06 02 00 00 70 00 04 00 0c a5 82 10 00 03 00
d0: 00 0c b5 02 10 00 03 00 00 00 00 00 00 00 00 00
e0: 00 00 00 00 00 00 00 00 00 00 00 00 00 00 00 00
f0: 00 00 00 00 00 00 00 00 b3 0f 41 08 00 00 00 00

0000:00:1f.4 SMBus: Intel Corporation Sunrise Point-LP SMBus (rev 21)
00: 86 80 23 9d 03 00 80 02 21 00 05 0c 00 00 00 00
10: 04 a0 22 df 00 00 00 00 00 00 00 00 00 00 00 00
20: 41 f0 00 00 00 00 00 00 00 00 00 00 86 80 70 72
30: 00 00 00 00 00 00 00 00 00 00 00 00 0b 01 00 00
40: 11 00 00 00 00 00 00 00 00 00 00 00 00 00 00 00
50: 01 04 00 00 00 01 00 00 00 00 00 00 00 00 00 00
60: 04 05 05 00 00 00 0a 0a 00 00 00 00 00 00 00 00
70: 00 00 00 00 00 00 00 00 00 00 00 00 00 00 00 00
80: 24 00 04 00 00 00 00 00 00 00 00 00 00 00 00 00
90: 00 00 00 00 00 00 00 00 00 00 00 00 00 00 00 00
a0: 00 00 00 00 00 00 00 00 00 00 00 00 00 00 00 00
b0: 00 00 00 00 00 00 00 00 00 00 00 00 00 00 00 00
c0: 00 00 00 00 00 00 00 00 00 00 00 00 00 00 00 00
d0: 00 00 00 00 00 00 00 00 00 00 00 00 00 00 00 00
e0: 00 00 00 00 00 00 00 00 00 00 00 00 00 00 00 00
f0: 00 00 00 00 00 00 00 00 b3 0f 41 08 00 00 00 00

0000:01:00.0 Network controller: Realtek Semiconductor Co., Ltd. RTL8822CE 802.11ac PCIe Wireless Network Adapter
00: ec 10 22 c8 07 04 10 00 00 00 80 02 10 00 00 00
10: 01 e0 00 00 00 00 00 00 04 00 10 df 00 00 00 00
20: 00 00 00 00 00 00 00 00 00 00 00 00 3c 10 f7 85
30: 00 00 00 00 40 00 00 00 00 00 00 00 0b 01 00 00
40: 01 50 c3 ff 08 00 00 00 00 00 00 00 00 00 00 00
50: 05 70 81 00 d8 02 e0 fe 00 00 00 00 00 00 00 00
60: 00 00 00 00 00 00 00 00 00 00 00 00 00 00 00 00
70: 10 00 02 00 80 8d 90 05 1f 20 10 00 11 6c 47 00
80: 40 01 11 10 00 00 00 00 00 00 00 00 00 00 00 00
90: 00 00 00 00 10 08 0c 00 00 04 00 00 02 00 00 00
a0: 00 00 00 00 00 00 00 00 00 00 00 00 00 00 00 00
b0: 00 00 00 00 00 00 00 00 00 00 00 00 00 00 00 00
c0: 00 00 00 00 00 00 00 00 00 00 00 00 00 00 00 00
d0: 00 00 00 00 00 00 00 00 00 00 00 00 00 00 00 00
e0: 00 00 00 00 00 00 00 00 00 00 00 00 00 00 00 00
f0: 00 00 00 00 00 00 00 00 00 00 00 00 00 00 00 00

0000:02:00.0 Ethernet controller: Realtek Semiconductor Co., Ltd. RTL8111/8168/8211/8411 PCI Express Gigabit Ethernet Controller (rev 15)
00: ec 10 68 81 07 04 10 00 15 00 00 02 10 00 00 00
10: 01 d0 00 00 00 00 00 00 04 40 00 df 00 00 00 00
20: 04 00 00 df 00 00 00 00 00 00 00 00 ec 10 23 01
30: 00 00 00 00 40 00 00 00 00 00 00 00 0b 01 00 00
40: 01 50 c3 ff 08 00 00 00 00 00 00 00 00 00 00 00
50: 05 70 80 00 00 00 00 00 00 00 00 00 00 00 00 00
60: 00 00 00 00 00 00 00 00 00 00 00 00 00 00 00 00
70: 10 b0 02 02 c0 8c 90 05 1f 50 10 00 11 7c 47 00
80: 40 01 11 10 00 00 00 00 00 00 00 00 00 00 00 00
90: 00 00 00 00 1f 08 0c 00 00 04 00 00 02 00 00 00
a0: 00 00 00 00 00 00 00 00 00 00 00 00 00 00 00 00
b0: 11 00 03 80 04 00 00 00 04 08 00 00 00 00 00 00
c0: 00 00 00 00 00 00 00 00 00 00 00 00 00 00 00 00
d0: 00 00 00 00 00 00 00 00 00 00 00 00 00 00 00 00
e0: 00 00 00 00 00 00 00 00 00 00 00 00 00 00 00 00
f0: 00 00 00 00 00 00 00 00 00 00 00 00 00 00 00 00

# exit 0
