# lspci -xxx -D
0000:00:00.0 Host bridge: Advanced Micro Devices, Inc. [AMD] Raven/Raven2 Root Complex
00: 22 10 d0 15 00 00 00 00 00 00 00 06 00 00 80 00
10: 00 00 00 00 00 00 00 00 00 00 00 00 00 00 00 00
20: 00 00 00 00 00 00 00 00 00 00 00 00 22 10 d0 15
30: 00 00 00 00 00 00 00 00 00 00 00 00 00 00 00 00
40: 00 00 00 00 00 00 00 00 80 00 00 00 10 00 80 00
50: 22 10 d0 15 00 00 00 00 00 00 00 00 00 00 00 00
60: 00 98 05 00 ef 0f 20 3f 00 00 00 00 00 00 00 00
70: 00 00 00 00 00 00 00 00 00 00 00 00 00 00 00 00
80: 00 00 00 00 08 01 00 00 00 00 00 00 00 00 00 00
90: 00 00 00 e0 00 00 00 00 00 00 00 00 00 00 00 00
a0: 00 00 00 00 4c 8a 05 00 00 00 00 00 00 00 00 00
b0: 00 00 00 00 00 00 00 00 e0 02 b1 13 01 01 10 fd
c0: 00 00 00 00 00 00 00 00 4c 8a 05 00 00 00 00 00
d0: 00 00 00 00 4c 8a 05 00 00 00 00 00 00 00 00 00
e0: 46 00 30 01 00 00 00 00 00 00 00 00 00 00 00 00
f0: 00 00 00 00 00 80 80 00 00 00 00 00 4c 8a 05 00

0000:00:00.2 IOMMU: Advanced Micro Devices, Inc. [AMD] Raven/Raven2 IOMMU
00: 22 10 d1 15 04 04 10 00 00 00 06 08 00 00 80 00
10: 00 00 00 00 00 00 00 00 00 00 00 00 00 00 00 00
20: 00 00 00 00 00 00 00 00 00 00 00 00 22 10 d1 15
30: 00 00 00 00 40 00 00 00 00 00 00 00 ff 01 00 00
40: 0f 64 0b 19 01 00 b8 fe 00 00 00 00 00 00 00 00
50: 40 30 20 00 80 00 00 00 00 00 00 00 00 00 00 00
60: 00 00 00 00 05 74 85 00 00 20 e0 fe 00 00 00 00
70: 20 00 00 00 08 00 03 a8 22 10 d1 15 01 2b 00 00
80: da 1a 20 62 cf cf 0b 00 00 00 00 00 00 00 00 00
90: 00 00 00 00 00 00 00 00 02 00 00 00 00 00 00 00
a0: 00 00 00 00 bf 7f 4f 2d 10 9c 73 0e 00 00 00 00
b0: 00 00 00 00 00 00 00 00 75 00 00 00 00 00 00 00
c0: 00 00 00 00 00 00 00 00 00 00 00 00 00 00 00 00
d0: 00 00 00 00 00 00 00 00 00 00 00 00 00 00 00 00
e0: 00 00 00 00 00 00 00 00 00 00 00 00 00 00 00 00
f0: 00 00 00 00 4c 8a 05 00 00 00 00 00 4c 8a 05 00

0000:00:01.0 Host bridge: Advanced Micro Devices, Inc. [AMD] Family 17h (Models 00h-1fh) PCIe Dummy Host Bridge
00: 22 10 52 14 00 00 00 00 00 00 00 06 00 00 80 00
10: 00 00 00 00 00 00 00 00 00 00 00 00 00 00 00 00
20: 00 00 00 00 00 00 00 00 00 00 00 00 00 00 00 00
30: 00 00 00 00 00 00 00 00 00 00 00 00 00 00 00 00
40: 80 00 00 00 00 00 00 00 00 00 00 00 00 00 00 00
50: 00 00 00 00 00 00 00 00 00 00 00 00 00 00 00 00
60: 00 00 00 00 00 00 00 00 00 00 00 00 00 00 00 00
70: 00 00 00 00 00 00 00 00 00 00 00 00 00 00 00 00
80: 00 00 00 00 00 00 00 00 00 00 00 00 00 00 00 00
90: 00 00 00 00 00 00 00 00 00 00 00 00 00 00 00 00
a0: 00 00 00 00 00 00 00 00 00 00 00 00 00 00 00 00
b0: 00 00 00 00 00 00 00 00 00 00 00 00 00 00 00 00
c0: 00 00 00 00 00 00 00 00 00 00 00 00 00 00 00 00
d0: 00 00 00 00 00 00 00 00 00 00 00 00 00 00 00 00
e0: 00 00 00 00 00 00 00 00 00 00 00 00 00 00 00 00
f0: 00 00 00 00 00 00 00 00 00 00 00 00 00 00 00 00

0000:00:01.2 PCI bridge: Advanced Micro Devices, Inc. [AMD] Raven/Raven2 PCIe GPP Bridge [6:0]
00: 22 10 d3 15 07 04 10 00 00 00 04 06 10 00 81 00
10: 00 00 00 00 00 00 00 00 00 01 01 00 f1 f1 00 00
20: f0 fc f0 fc f1 ff 01 00 00 00 00 00 00 00 00 00
30: 00 00 00 00 50 00 00 00 00 00 00 00 ff 00 12 00
40: 00 00 00 00 00 00 00 00 00 00 00 00 00 00 00 00
50: 01 58 03 c8 00 00 00 00 10 a0 42 01 22 80 00 00
60: 1f 29 00 00 13 78 73 05 42 0c 11 30 00 00 04 00
70: 00 00 40 01 18 00 01 00 00 00 00 00 bf 01 70 00
80: 06 00 00 00 0e 00 00 00 02 00 01 00 00 00 00 00
90: 00 00 00 00 00 00 00 00 00 00 00 00 00 00 00 00
a0: 05 c0 81 00 00 00 e0 fe 00 00 00 00 00 00 00 00
b0: 00 00 00 00 00 00 00 00 00 00 00 00 00 00 00 00
c0: 0d c8 00 00 22 10 53 14 08 00 03 a8 00 00 00 00
d0: 00 00 00 00 00 00 00 00 00 00 00 00 00 00 00 00
e0: 00 00 00 00 4c 8a 05 00 00 00 00 00 00 00 00 00
f0: 00 00 00 00 00 00 00 00 00 00 00 00 00 00 00 00

0000:00:01.3 PCI bridge: Advanced Micro Devices, Inc. [AMD] Raven/Raven2 PCIe GPP Bridge [6:0]
00: 22 10 d3 15 07 04 10 00 00 00 04 06 10 00 81 00
10: 00 00 00 00 00 00 00 00 00 02 02 00 e1 e1 00 00
20: e0 fc e0 fc f1 ff 01 00 00 00 00 00 00 00 00 00
30: 00 00 00 00 50 00 00 00 00 00 00 00 ff 00 12 00
40: 00 00 00 00 00 00 00 00 00 00 00 00 00 00 00 00
50: 01 58 03 c8 00 00 00 00 10 a0 42 01 22 80 00 00
60: 1f 29 00 00 13 78 73 06 40 0c 11 30 00 00 04 00
70: 00 00 40 01 18 00 01 00 00 00 00 00 bf 01 70 00
80: 06 00 00 00 0e 00 00 00 03 00 01 00 00 00 00 00
90: 00 00 00 00 00 00 00 00 00 00 00 00 00 00 00 00
a0: 05 c0 81 00 00 00 e0 fe 00 00 00 00 00 00 00 00
b0: 00 00 00 00 00 00 00 00 00 00 00 00 00 00 00 00
c0: 0d c8 00 00 22 10 53 14 08 00 03 a8 00 00 00 00
d0: 00 00 00 00 00 00 00 00 00 00 00 00 00 00 00 00
e0: 00 00 00 00 4c 8a 05 00 00 00 00 00 00 00 00 00
f0: 00 00 00 00 00 00 00 00 00 00 00 00 00 00 00 00

0000:00:01.5 PCI bridge: Advanced Micro Devices, Inc. [AMD] Raven/Raven2 PCIe GPP Bridge [6:0]
00: 22 10 d3 15 07 04 10 00 00 00 04 06 10 00 81 00
10: 00 00 00 00 00 00 00 00 00 03 03 00 d1 d1 00 00
20: d0 fc d0 fc f1 ff 01 00 00 00 00 00 00 00 00 00
30: 00 00 00 00 50 00 00 00 00 00 00 00 ff 00 12 00
40: 00 00 00 00 00 00 00 00 00 00 00 00 00 00 00 00
50: 01 58 03 c8 00 00 00 00 10 a0 42 01 22 80 00 00
60: 1f 29 00 00 13 78 73 03 40 0c 11 30 00 00 04 00
70: 00 00 40 01 18 00 01 00 00 00 00 00 bf 01 70 00
80: 06 00 00 00 0e 00 00 00 03 00 01 00 00 00 00 00
90: 00 00 00 00 00 00 00 00 00 00 00 00 00 00 00 00
a0: 05 c0 81 00 00 00 e0 fe 00 00 00 00 00 00 00 00
b0: 00 00 00 00 00 00 00 00 00 00 00 00 00 00 00 00
c0: 0d c8 00 00 22 10 53 14 08 00 03 a8 00 00 00 00
d0: 00 00 00 00 00 00 00 00 00 00 00 00 00 00 00 00
e0: 00 00 00 00 4c 8a 05 00 00 00 00 00 00 00 00 00
f0: 00 00 00 00 00 00 00 00 00 00 00 00 00 00 00 00

0000:00:08.0 Host bridge: Advanced Micro Devices, Inc. [AMD] Family 17h (Models 00h-1fh) PCIe Dummy Host Bridge
00: 22 10 52 14 00 00 00 00 00 00 00 06 00 00 80 00
10: 00 00 00 00 00 00 00 00 00 00 00 00 00 00 00 00
20: 00 00 00 00 00 00 00 00 00 00 00 00 00 00 00 00
30: 00 00 00 00 00 00 00 00 00 00 00 00 00 00 00 00
40: 80 00 00 00 00 00 00 00 00 00 00 00 00 00 00 00
50: 00 00 00 00 00 00 00 00 00 00 00 00 00 00 00 00
60: 00 00 00 00 00 00 00 00 00 00 00 00 00 00 00 00
70: 00 00 00 00 00 00 00 00 00 00 00 00 00 00 00 00
80: 00 00 00 00 00 00 00 00 00 00 00 00 00 00 00 00
90: 00 00 00 00 00 00 00 00 00 00 00 00 00 00 00 00
a0: 00 00 00 00 00 00 00 00 00 00 00 00 00 00 00 00
b0: 00 00 00 00 00 00 00 00 00 00 00 00 00 00 00 00
c0: 00 00 00 00 00 00 00 00 00 00 00 00 00 00 00 00
d0: 00 00 00 00 00 00 00 00 00 00 00 00 00 00 00 00
e0: 00 00 00 00 00 00 00 00 00 00 00 00 00 00 00 00
f0: 00 00 00 00 00 00 00 00 00 00 00 00 00 00 00 00

0000:00:08.1 PCI bridge: Advanced Micro Devices, Inc. [AMD] Raven/Raven2 Internal PCIe GPP Bridge 0 to Bus A
00: 22 10 db 15 07 04 10 00 00 00 04 06 10 00 81 00
10: 00 00 00 00 00 00 00 00 00 04 04 00 c1 c1 00 00
20: 80 fc b0 fc 01 e0 11 f0 00 00 00 00 00 00 00 00
30: 00 00 00 00 50 00 00 00 00 00 00 00 ff 01 12 00
40: 00 00 00 00 00 00 00 00 00 00 00 00 00 00 00 00
50: 01 58 03 c8 00 00 00 00 10 a0 42 00 22 80 00 00
60: 30 29 00 00 03 0d 70 00 40 0c 03 31 00 00 00 00
70: 00 00 40 00 18 00 01 00 01 04 00 00 80 09 30 00
80: 00 00 00 00 0e 00 00 00 43 00 1f 00 00 00 00 00
90: 00 00 00 00 00 00 00 00 00 00 00 00 00 00 00 00
a0: 05 c0 81 00 00 00 e0 fe 00 00 00 00 00 00 00 00
b0: 00 00 00 00 00 00 00 00 00 00 00 00 00 00 00 00
c0: 0d 00 00 00 22 10 00 00 00 00 00 00 00 00 00 00
d0: 00 00 00 00 00 00 00 00 00 00 00 00 00 00 00 00
e0: 00 00 00 00 4c 8a 05 00 00 00 00 00 00 00 00 00
f0: 00 00 00 00 00 00 00 00 00 00 00 00 00 00 00 00

0000:00:08.2 PCI bridge: Advanced Micro Devices, Inc. [AMD] Raven/Raven2 Internal PCIe GPP Bridge 0 to Bus B
00: 22 10 dc 15 07 04 10 00 00 00 04 06 10 00 81 00
10: 00 00 00 00 00 00 00 00 00 05 05 00 f1 01 00 00
20: c0 fc c0 fc f1 ff 01 00 00 00 00 00 00 00 00 00
30: 00 00 00 00 50 00 00 00 00 00 00 00 ff 01 12 00
40: 00 00 00 00 00 00 00 00 00 00 00 00 00 00 00 00
50: 01 58 03 c8 00 00 00 00 10 a0 42 00 22 80 00 00
60: 3f 29 00 00 03 0d 70 00 40 0c 03 31 00 00 00 00
70: 00 00 40 00 18 00 01 00 00 00 00 00 00 00 00 00
80: 00 00 00 00 0e 00 00 00 43 00 1f 00 00 00 00 00
90: 00 00 00 00 00 00 00 00 00 00 00 00 00 00 00 00
a0: 05 c0 81 00 00 00 e0 fe 00 00 00 00 00 00 00 00
b0: 00 00 00 00 00 00 00 00 00 00 00 00 00 00 00 00
c0: 0d 00 00 00 22 10 00 00 00 00 00 00 00 00 00 00
d0: 00 00 00 00 00 00 00 00 00 00 00 00 00 00 00 00
e0: 00 00 00 00 4c 8a 05 00 00 00 00 00 00 00 00 00
f0: 00 00 00 00 00 00 00 00 00 00 00 00 00 00 00 00

0000:00:14.0 SMBus: Advanced Micro Devices, Inc. [AMD] FCH SMBus Controller (rev 61)
00: 22 10 0b 79 03 04 20 02 61 00 05 0c 00 00 80 00
10: 00 00 00 00 00 00 00 00 00 00 00 00 00 00 00 00
20: 00 00 00 00 00 00 00 00 00 00 00 00 22 10 0b 79
30: 00 00 00 00 00 00 00 00 00 00 00 00 00 00 00 00
40: 00 00 00 00 00 00 00 00 00 00 00 00 00 00 00 00
50: 00 00 00 00 00 00 00 00 00 00 00 00 00 00 00 00
60: 00 00 00 00 00 00 00 00 00 00 00 00 00 00 00 00
70: 00 00 00 00 00 00 00 00 00 00 00 00 00 00 00 00
80: 00 00 00 00 00 00 00 00 00 00 00 00 00 00 00 00
90: 00 00 00 00 00 00 00 00 00 00 00 00 00 00 00 00
a0: 00 00 00 00 00 00 00 00 00 00 00 00 00 00 00 00
b0: 00 00 00 00 00 00 00 00 00 00 00 00 00 00 00 00
c0: 00 00 00 00 00 00 00 00 00 00 00 00 00 00 00 00
d0: 00 00 00 00 00 00 00 00 00 00 00 00 00 00 00 00
e0: 00 00 00 00 00 00 00 00 00 00 00 00 00 00 00 00
f0: 00 00 00 00 00 00 00 00 00 00 00 00 00 00 00 00

0000:00:14.3 ISA bridge: Advanced Micro Devices, Inc. [AMD] FCH LPC Bridge (rev 51)
00: 22 10 0e 79 0f 00 20 02 51 00 01 06 00 00 80 00
10: 00 00 00 00 00 00 00 00 00 00 00 00 00 00 00 00
20: 00 00 00 00 00 00 00 00 00 00 00 00 22 10 0e 79
30: 00 00 00 00 00 00 00 00 00 00 00 00 00 00 00 00
40: 1c 00 00 00 d5 ff 03 ff 07 ff 24 00 00 00 00 00
50: 00 00 00 00 00 00 00 00 00 00 00 00 00 00 00 00
60: 00 00 00 00 40 16 00 00 00 00 0f 00 00 ff ff ff
70: 67 45 23 00 00 00 00 00 90 02 00 00 02 0a 00 00
80: 08 00 03 a8 00 00 00 00 00 00 00 00 00 00 00 00
90: 00 00 00 00 00 00 00 00 00 00 00 00 00 00 00 00
a0: 02 00 c1 fe 2f 01 00 00 00 00 00 00 00 00 00 00
b0: 00 00 00 00 00 00 00 00 04 00 ed 3f 00 00 00 00
c0: 00 00 00 00 00 00 00 00 00 00 00 00 00 00 f7 ff
d0: 86 ff fd 88 42 00 00 00 00 00 00 00 01 00 00 00
e0: 00 00 00 00 00 00 00 00 00 00 00 00 00 00 00 00
f0: 00 00 00 00 00 00 00 00 00 00 00 00 00 00 00 00

0000:00:18.0 Host bridge: Advanced Micro Devices, Inc. [AMD] Raven/Raven2 Device 24: Function 0
00: 22 10 e8 15 00 00 00 00 00 00 00 06 00 00 80 00
10: 00 00 00 00 00 00 00 00 00 00 00 00 00 00 00 00
20: 00 00 00 00 00 00 00 00 00 00 00 00 00 00 00 00
30: 00 00 00 00 00 00 00 00 00 00 00 00 00 00 00 00
40: 0f 00 00 00 27 12 95 03 1f 0f 0b 0f 0c 00 00 00
50: 0f 0f 00 00 00 00 00 00 00 00 00 00 00 00 00 00
60: 00 00 00 00 00 00 00 00 00 00 00 00 00 00 00 00
70: 00 00 00 00 00 00 00 00 00 00 00 00 00 00 00 00
80: 91 00 00 00 00 00 00 00 00 00 00 00 00 00 00 00
90: 01 00 00 00 00 00 00 00 0a 09 09 09 09 09 09 09
a0: 93 00 00 05 90 00 00 00 90 00 00 00 90 00 00 00
b0: 90 00 00 00 90 00 00 00 90 00 00 00 90 00 00 00
c0: 03 c0 00 00 09 f0 00 00 00 00 00 00 09 00 00 00
d0: 00 00 00 00 09 00 00 00 00 00 00 00 09 00 00 00
e0: 00 00 00 00 09 00 00 00 00 00 00 00 09 00 00 00
f0: 00 00 00 00 09 00 00 00 00 00 00 00 09 00 00 00

0000:00:18.1 Host bridge: Advanced Micro Devices, Inc. [AMD] Raven/Raven2 Device 24: Function 1
00: 22 10 e9 15 00 00 00 00 00 00 00 06 00 00 80 00
10: 00 00 00 00 00 00 00 00 00 00 00 00 00 00 00 00
20: 00 00 00 00 00 00 00 00 00 00 00 00 00 00 00 00
30: 00 00 00 00 00 00 00 00 00 00 00 00 00 00 00 00
40: 00 00 00 00 00 00 00 00 00 00 00 00 00 00 00 00
50: 00 00 00 00 00 00 00 00 00 00 00 00 00 00 00 00
60: 0a 0a 09 09 07 00 00 00 00 00 00 00 00 00 00 00
70: 00 00 00 00 00 00 00 00 00 00 00 00 00 00 00 00
80: 00 00 00 00 00 00 00 00 00 00 00 00 00 00 00 00
90: 00 00 00 00 00 00 00 00 00 00 00 00 00 00 00 00
a0: 02 53 53 53 ff 01 ff 01 e0 00 00 00 00 00 00 00
b0: 01 00 00 00 00 00 00 00 08 00 00 00 00 00 00 00
c0: 01 00 00 00 81 fc 06 00 00 00 00 00 00 00 00 00
d0: 10 10 18 00 00 00 00 00 00 00 00 00 00 00 00 00
e0: 0e 01 03 00 0c 00 00 00 08 00 00 00 3f ff de 07
f0: 16 ff e5 04 22 ff ff 05 1f fb f5 02 1c f0 cf 02

0000:00:18.2 Host bridge: Advanced Micro Devices, Inc. [AMD] Raven/Raven2 Device 24: Function 2
00: 22 10 ea 15 00 00 00 00 00 00 00 06 00 00 80 00
10: 00 00 00 00 00 00 00 00 00 00 00 00 00 00 00 00
20: 00 00 00 00 00 00 00 00 00 00 00 00 00 00 00 00
30: 00 00 00 00 00 00 00 00 00 00 00 00 00 00 00 00
40: 80 00 1f 40 13 0f 40 81 c0 80 80 00 11 00 00 00
50: 20 00 00 00 00 00 00 00 00 00 00 00 00 00 00 00
60: 00 00 00 00 00 00 00 00 19 50 06 00 19 06 06 14
70: 00 01 00 02 00 04 00 08 00 10 00 20 00 40 00 80
80: cf 1e 02 00 ef 1e 02 00 37 05 3f 00 00 00 00 00
90: df 1e 02 00 df 1e 02 00 37 05 03 00 00 00 00 00
a0: ef 1e 02 00 ef 1e 02 00 37 05 00 00 00 00 00 00
b0: cf 1e 02 00 cf 1e 02 00 05 00 00 08 00 00 00 00
c0: 00 00 00 00 00 00 00 00 00 00 00 00 00 00 00 00
d0: 00 00 00 00 00 00 00 00 00 00 00 00 00 00 00 00
e0: 00 00 00 00 00 00 00 00 00 00 00 00 00 00 00 00
f0: 00 00 00 00 00 00 00 00 00 00 00 00 00 00 00 00

0000:00:18.3 Host bridge: Advanced Micro Devices, Inc. [AMD] Raven/Raven2 Device 24: Function 3
00: 22 10 eb 15 00 00 00 00 00 00 00 06 00 00 80 00
10: 00 00 00 00 00 00 00 00 00 00 00 00 00 00 00 00
20: 00 00 00 00 00 00 00 00 00 00 00 00 00 00 00 00
30: 00 00 00 00 00 00 00 00 00 00 00 00 00 00 00 00
40: 04 00 00 00 00 00 00 00 00 00 00 00 27 03 00 00
50: 00 00 00 00 00 00 00 00 00 00 00 00 00 00 00 00
60: 00 00 00 00 00 00 00 00 00 00 00 00 00 00 00 00
70: 00 00 00 00 00 00 00 00 00 00 00 00 00 00 00 00
80: 00 00 00 00 00 00 00 00 00 00 00 00 00 00 00 00
90: 00 00 00 00 00 00 00 00 00 00 00 00 00 00 00 00
a0: 00 00 00 00 00 00 00 00 00 00 00 00 00 00 00 00
b0: 00 00 00 00 00 00 00 00 00 00 00 00 00 00 00 00
c0: 00 00 00 00 00 00 00 00 00 00 00 00 00 00 00 00
d0: 00 00 00 00 00 00 00 00 00 00 00 00 00 00 00 00
e0: 00 00 00 00 00 00 00 00 00 00 00 00 00 00 00 00
f0: 00 00 00 00 00 00 00 00 00 00 00 00 00 00 00 00

0000:00:18.4 Host bridge: Advanced Micro Devices, Inc. [AMD] Raven/Raven2 Device 24: Function 4
00: 22 10 ec 15 00 00 00 00 00 00 00 06 00 00 80 00
10: 00 00 00 00 00 00 00 00 00 00 00 00 00 00 00 00
20: 00 00 00 00 00 00 00 00 00 00 00 00 00 00 00 00
30: 00 00 00 00 00 00 00 00 00 00 00 00 00 00 00 00
40: 02 00 00 00 00 00 00 00 00 00 00 00 00 00 00 00
50: 51 10 01 00 00 00 00 00 00 00 00 00 04 01 00 00
60: 08 02 00 00 00 00 00 00 00 00 00 00 00 00 00 00
70: 00 00 00 00 00 00 00 00 00 00 00 00 00 00 00 00
80: 20 00 00 00 20 00 00 00 22 10 e8 15 22 10 e8 15
90: 22 10 e8 15 22 10 e8 15 01 00 00 e0 01 00 00 e0
a0: 93 00 00 00 93 00 00 00 22 10 e8 15 22 10 e8 15
b0: 00 00 00 00 00 00 00 00 00 00 00 00 00 00 00 00
c0: 00 03 00 00 01 00 02 00 00 00 02 01 03 0b 0e 00
d0: 00 00 00 00 00 00 00 00 00 00 00 00 00 00 00 00
e0: 00 00 00 00 00 00 00 00 00 00 00 00 00 00 00 00
f0: 00 00 00 00 00 00 00 00 00 00 00 00 20 20 20 00

0000:00:18.5 Host bridge: Advanced Micro Devices, Inc. [AMD] Raven/Raven2 Device 24: Function 5
00: 22 10 ed 15 00 00 00 00 00 00 00 06 00 00 80 00
10: 00 00 00 00 00 00 00 00 00 00 00 00 00 00 00 00
20: 00 00 00 00 00 00 00 00 00 00 00 00 00 00 00 00
30: 00 00 00 00 00 00 00 00 00 00 00 00 00 00 00 00
40: 00 00 00 00 00 00 00 00 00 00 00 00 00 00 00 00
50: 00 00 00 00 00 00 00 00 00 00 00 00 00 00 00 00
60: 00 00 00 00 00 00 00 00 00 00 00 00 00 00 00 00
70: 00 00 00 00 00 00 00 00 00 00 00 00 00 00 00 00
80: 00 00 00 00 00 00 00 00 00 00 00 00 00 00 00 00
90: 01 00 d7 01 01 00 00 00 01 00 00 00 00 00 00 00
a0: 00 00 00 00 00 00 00 00 00 00 00 00 00 00 00 00
b0: 00 00 00 00 00 00 00 00 00 00 00 00 00 00 00 00
c0: 00 00 00 00 00 00 00 00 00 00 00 00 00 00 00 00
d0: 00 00 00 00 00 00 00 00 00 00 00 00 00 00 00 00
e0: 00 00 00 00 00 00 00 00 00 00 00 00 00 00 00 00
f0: 00 00 00 00 00 00 00 00 00 00 00 00 80 00 00 00

0000:00:18.6 Host bridge: Advanced Micro Devices, Inc. [AMD] Raven/Raven2 Device 24: Function 6
00: 22 10 ee 15 00 00 00 00 00 00 00 06 00 00 80 00
10: 00 00 00 00 00 00 00 00 00 00 00 00 00 00 00 00
20: 00 00 00 00 00 00 00 00 00 00 00 00 00 00 00 00
30: 00 00 00 00 00 00 00 00 00 00 00 00 00 00 00 00
40: 00 00 00 00 00 00 00 00 00 00 00 00 00 00 00 00
50: 00 00 00 00 00 00 00 00 00 00 00 00 00 00 00 00
60: 00 00 00 00 00 00 00 00 00 00 00 00 00 00 00 00
70: 00 00 00 00 00 00 00 00 00 00 00 00 00 00 00 00
80: 00 00 00 00 00 00 00 00 00 00 00 00 00 00 00 00
90: 00 00 00 00 00 00 00 00 00 00 00 00 00 00 00 00
a0: 00 00 00 00 00 00 00 00 00 00 00 00 00 00 00 00
b0: 00 00 00 00 00 00 00 00 00 00 00 00 00 00 00 00
c0: 00 00 00 00 00 00 00 00 00 00 00 00 00 00 00 00
d0: 00 00 00 00 00 00 00 00 00 00 00 00 00 00 0f 00
e0: 00 00 00 00 00 00 00 00 00 00 00 00 00 00 00 00
f0: 00 00 00 00 00 00 00 00 00 00 00 00 00 00 00 00

0000:00:18.7 Host bridge: Advanced Micro Devices, Inc. [AMD] Raven/Raven2 Device 24: Function 7
00: 22 10 ef 15 00 00 00 00 00 00 00 06 00 00 80 00
10: 00 00 00 00 00 00 00 00 00 00 00 00 00 00 00 00
20: 00 00 00 00 00 00 00 00 00 00 00 00 00 00 00 00
30: 00 00 00 00 00 00 00 00 00 00 00 00 00 00 00 00
40: 00 00 00 00 00 00 00 00 00 00 00 00 00 00 00 00
50: 00 00 00 00 00 00 00 00 00 00 00 00 00 00 00 00
60: 00 00 00 00 00 00 00 00 00 00 00 00 00 00 00 00
70: 00 00 00 00 00 00 00 00 00 00 00 00 00 00 00 00
80: 00 00 00 00 00 00 00 00 00 00 00 00 00 00 00 00
90: 00 00 00 00 00 00 00 00 00 00 00 00 00 00 00 00
a0: 00 00 00 00 00 00 00 00 00 00 00 00 00 00 00 00
b0: 00 00 00 00 00 00 00 00 00 00 00 00 00 00 00 00
c0: 00 00 00 00 00 00 00 00 00 00 00 00 00 00 00 00
d0: 00 00 00 00 00 00 00 00 00 00 00 00 00 00 00 00
e0: 00 00 00 00 00 00 00 00 00 00 00 00 00 00 00 00
f0: 00 00 00 00 00 00 00 00 00 00 00 00 00 00 00 00

0000:01:00.0 Network controller: Realtek Semiconductor Co., Ltd. RTL8822CE 802.11ac PCIe Wireless Network Adapter
00: ec 10 22 c8 07 04 10 00 00 00 80 02 10 00 00 00
10: 01 f0 00 00 00 00 00 00 04 00 f0 fc 00 00 00 00
20: 00 00 00 00 00 00 00 00 00 00 00 00 ec 10 22 c8
30: 00 00 00 00 40 00 00 00 00 00 00 00 ff 01 00 00
40: 01 50 c3 ff 08 00 00 00 00 00 00 00 00 00 00 00
50: 05 70 81 00 00 00 e0 fe 00 00 00 00 00 00 00 00
60: 00 00 00 00 00 00 00 00 00 00 00 00 00 00 00 00
70: 10 00 02 00 80 8d 00 00 1f 20 19 00 11 6c 47 00
80: 42 01 11 10 00 00 00 00 00 00 00 00 00 00 00 00
90: 00 00 00 00 10 08 0c 00 00 00 00 00 02 00 00 00
a0: 00 00 00 00 00 00 00 00 00 00 00 00 00 00 00 00
b0: 00 00 00 00 00 00 00 00 00 00 00 00 00 00 00 00
c0: 00 00 00 00 00 00 00 00 00 00 00 00 00 00 00 00
d0: 00 00 00 00 00 00 00 00 00 00 00 00 00 00 00 00
e0: 00 00 00 00 00 00 00 00 00 00 00 00 00 00 00 00
f0: 00 00 00 00 00 00 00 00 00 00 00 00 00 00 00 00

0000:02:00.0 Ethernet controller: Realtek Semiconductor Co., Ltd. RTL8111/8168/8211/8411 PCI Express Gigabit Ethernet Controller (rev 15)
00: ec 10 68 81 07 04 10 00 15 00 00 02 10 00 00 00
10: 01 e0 00 00 00 00 00 00 04 40 e0 fc 00 00 00 00
20: 04 00 e0 fc 00 00 00 00 00 00 00 00 ec 10 68 81
30: 00 00 00 00 40 00 00 00 00 00 00 00 ff 01 00 00
40: 01 50 c3 ff 08 00 00 00 00 00 00 00 00 00 00 00
50: 05 70 80 00 00 00 00 00 00 00 00 00 00 00 00 00
60: 00 00 00 00 00 00 00 00 00 00 00 00 00 00 00 00
70: 10 b0 02 02 c0 8c 00 00 1f 50 10 00 11 7c 47 00
80: 40 01 11 10 00 00 00 00 00 00 00 00 00 00 00 00
90: 00 00 00 00 1f 08 0c 00 00 00 00 00 02 00 00 00
a0: 00 00 00 00 00 00 00 00 00 00 00 00 00 00 00 00
b0: 11 00 03 80 04 00 00 00 04 08 00 00 00 00 00 00
c0: 00 00 00 00 00 00 00 00 00 00 00 00 00 00 00 00
d0: 00 00 00 00 00 00 00 00 00 00 00 00 00 00 00 00
e0: 00 00 00 00 00 00 00 00 00 00 00 00 00 00 00 00
f0: 00 00 00 00 00 00 00 00 00 00 00 00 00 00 00 00

0000:03:00.0 Ethernet controller: Realtek Semiconductor Co., Ltd. RTL8111/8168/8211/8411 PCI Express Gigabit Ethernet Controller (rev 15)
00: ec 10 68 81 07 04 10 00 15 00 00 02 10 00 00 00
10: 01 d0 00 00 00 00 00 00 04 40 d0 fc 00 00 00 00
20: 04 00 d0 fc 00 00 00 00 00 00 00 00 ec 10 68 81
30: 00 00 00 00 40 00 00 00 00 00 00 00 ff 01 00 00
40: 01 50 c3 ff 08 00 00 00 00 00 00 00 00 00 00 00
50: 05 70 80 00 00 00 00 00 00 00 00 00 00 00 00 00
60: 00 00 00 00 00 00 00 00 00 00 00 00 00 00 00 00
70: 10 b0 02 02 c0 8c 00 00 1f 50 19 00 11 7c 47 00
80: 40 01 11 10 00 00 00 00 00 00 00 00 00 00 00 00
90: 00 00 00 00 1f 08 0c 00 00 00 00 00 02 00 00 00
a0: 00 00 00 00 00 00 00 00 00 00 00 00 00 00 00 00
b0: 11 00 03 80 04 00 00 00 04 08 00 00 00 00 00 00
c0: 00 00 00 00 00 00 00 00 00 00 00 00 00 00 00 00
d0: 00 00 00 00 00 00 00 00 00 00 00 00 00 00 00 00
e0: 00 00 00 00 00 00 00 00 00 00 00 00 00 00 00 00
f0: 00 00 00 00 00 00 00 00 00 00 00 00 00 00 00 00

0000:04:00.0 VGA compatible controller: Advanced Micro Devices, Inc. [AMD/ATI] Picasso/Raven 2 [Radeon Vega Series / Radeon Vega Mobile Series] (rev c2)
00: 02 10 d8 15 07 04 10 00 c2 00 00 03 10 00 80 00
10: 0c 00 00 e0 00 00 00 00 0c 00 00 f0 00 00 00 00
20: 01 c0 00 00 00 00 b0 fc 00 00 00 00 02 10 23 01
30: 00 00 00 00 48 00 00 00 00 00 00 00 ff 01 00 00
40: 00 00 00 00 00 00 00 00 09 50 08 00 02 10 23 01
50: 01 64 03 f0 00 00 00 00 00 00 00 00 00 00 00 00
60: 00 00 00 00 10 a0 12 00 a1 8f 00 10 30 29 00 00
70: 03 0d 40 00 40 00 03 11 00 00 00 00 00 00 00 00
80: 00 00 00 00 00 00 00 00 00 08 70 00 00 00 00 00
90: 0e 00 00 00 03 00 1f 00 00 00 00 00 00 00 00 00
a0: 05 c0 84 00 00 00 00 00 00 00 00 00 00 00 00 00
b0: 00 00 00 00 00 00 00 00 00 00 00 00 00 00 00 00
c0: 11 00 02 80 05 20 04 00 05 30 04 00 00 00 00 00
d0: 00 00 00 00 00 00 00 00 00 00 00 00 00 00 00 00
e0: 00 00 00 00 00 00 00 00 00 00 00 00 00 00 00 00
f0: 00 00 00 00 00 00 00 00 00 00 00 00 00 00 00 00

0000:04:00.1 Audio device: Advanced Micro Devices, Inc. [AMD/ATI] Raven/Raven2/Fenghuang HDMI/DP Audio Controller
00: 02 10 de 15 06 04 10 00 00 00 03 04 10 00 80 00
10: 00 80 b8 fc 00 00 00 00 00 00 00 00 00 00 00 00
20: 00 00 00 00 00 00 00 00 00 00 00 00 02 10 de 15
30: 00 00 00 00 48 00 00 00 00 00 00 00 ff 02 00 00
40: 00 00 00 00 00 00 00 00 09 50 08 00 02 10 de 15
50: 01 64 03 f0 03 01 00 00 00 00 00 00 00 00 00 00
60: 00 00 00 00 10 a0 12 00 a1 8f 00 10 30 29 00 00
70: 03 0d 40 00 40 00 03 11 00 00 00 00 00 00 00 00
80: 00 00 00 00 00 00 00 00 00 08 70 00 00 00 00 00
90: 0e 00 00 00 00 00 01 00 00 00 00 00 00 00 00 00
a0: 05 00 81 00 00 00 e0 fe 00 00 00 00 00 00 00 00
b0: 00 00 00 00 00 00 00 00 00 00 00 00 00 00 00 00
c0: 00 00 00 00 00 00 00 00 00 00 00 00 00 00 00 00
d0: 00 00 00 00 00 00 00 00 00 00 00 00 00 00 00 00
e0: 00 00 00 00 00 00 00 00 00 00 00 00 00 00 00 00
f0: 00 00 00 00 00 00 00 00 00 00 00 00 00 00 00 00

0000:04:00.2 Encryption controller: Advanced Micro Devices, Inc. [AMD] Raven/Raven2/FireFlight/Renoir/Cezanne Platform Security Processor
00: 22 10 df 15 06 04 10 08 00 00 80 10 10 00 80 00
10: 00 00 00 00 00 00 00 00 00 00 a0 fc 00 00 00 00
20: 00 00 00 00 00 c0 b8 fc 00 00 00 00 22 10 df 15
30: 00 00 00 00 48 00 00 00 00 00 00 00 ff 03 00 00
40: 00 00 00 00 00 00 00 00 09 50 08 00 22 10 df 15
50: 01 64 03 00 08 00 00 00 00 00 00 00 00 00 00 00
60: 00 00 00 00 10 a0 02 00 a1 8f 00 00 30 29 00 00
70: 03 0d 40 00 40 00 03 11 00 00 00 00 00 00 00 00
80: 00 00 00 00 00 00 00 00 00 08 70 00 00 00 00 00
90: 0e 00 00 00 00 00 01 00 00 00 00 00 00 00 00 00
a0: 05 c0 82 00 00 00 00 00 00 00 00 00 00 00 00 00
b0: 00 00 00 00 00 00 00 00 00 00 00 00 00 00 00 00
c0: 11 00 01 80 05 00 00 00 05 10 00 00 00 00 00 00
d0: 00 00 00 00 00 00 00 00 00 00 00 00 00 00 00 00
e0: 00 00 00 00 00 00 00 00 00 00 00 00 00 00 00 00
f0: 00 00 00 00 00 00 00 00 00 00 00 00 00 00 00 00

0000:04:00.3 USB controller: Advanced Micro Devices, Inc. [AMD] Raven USB 3.1
00: 22 10 e0 15 07 04 10 00 00 30 03 0c 10 00 80 00
10: 04 00 90 fc 00 00 00 00 00 00 00 00 00 00 00 00
20: 00 00 00 00 00 00 00 00 00 00 00 00 22 10 14 79
30: 00 00 00 00 48 00 00 00 00 00 00 00 ff 04 00 00
40: 00 00 00 00 00 00 00 00 09 50 08 00 22 10 14 79
50: 01 64 03 c8 00 00 00 00 00 00 00 00 00 00 00 00
60: 31 20 00 00 10 a0 02 00 a1 8f 00 00 30 29 00 00
70: 03 0d 40 00 40 00 03 11 00 00 00 00 00 00 00 00
80: 00 00 00 00 00 00 00 00 00 08 70 00 00 00 00 00
90: 0e 00 00 00 00 00 01 00 00 00 00 00 00 00 00 00
a0: 05 c0 86 00 00 00 00 00 00 00 00 00 00 00 00 00
b0: 00 00 00 00 00 00 00 00 00 00 00 00 00 00 00 00
c0: 11 00 07 80 00 e0 0f 00 00 f0 0f 00 00 00 00 00
d0: 00 00 00 00 00 00 00 00 00 00 00 00 00 00 00 00
e0: 00 00 00 00 00 00 00 00 00 00 00 00 00 00 00 00
f0: 00 00 00 00 00 00 00 00 00 00 00 00 00 00 00 00

0000:04:00.4 USB controller: Advanced Micro Devices, Inc. [AMD] Raven USB 3.1
00: 22 10 e1 15 07 04 10 00 00 30 03 0c 10 00 80 00
10: 04 00 80 fc 00 00 00 00 00 00 00 00 00 00 00 00
20: 00 00 00 00 00 00 00 00 00 00 00 00 22 10 14 79
30: 00 00 00 00 48 00 00 00 00 00 00 00 ff 01 00 00
40: 00 00 00 00 00 00 00 00 09 50 08 00 22 10 14 79
50: 01 64 03 c8 00 00 00 00 00 00 00 00 00 00 00 00
60: 31 20 00 00 10 a0 02 00 a1 8f 00 00 30 29 00 00
70: 03 0d 40 00 40 00 03 11 00 00 00 00 00 00 00 00
80: 00 00 00 00 00 00 00 00 00 08 70 00 00 00 00 00
90: 0e 00 00 00 00 00 01 00 00 00 00 00 00 00 00 00
a0: 05 c0 86 00 00 00 00 00 00 00 00 00 00 00 00 00
b0: 00 00 00 00 00 00 00 00 00 00 00 00 00 00 00 00
c0: 11 00 07 80 00 e0 0f 00 00 f0 0f 00 00 00 00 00
d0: 00 00 00 00 00 00 00 00 00 00 00 00 00 00 00 00
e0: 00 00 00 00 00 00 00 00 00 00 00 00 00 00 00 00
f0: 00 00 00 00 00 00 00 00 00 00 00 00 00 00 00 00

0000:04:00.6 Audio device: Advanced Micro Devices, Inc. [AMD] Ryzen HD Audio Controller
00: 22 10 e3 15 06 04 10 00 00 00 03 04 10 00 80 00
10: 00 00 b8 fc 00 00 00 00 00 00 00 00 00 00 00 00
20: 00 00 00 00 00 00 00 00 00 00 00 00 f1 14 10 04
30: 00 00 00 00 48 00 00 00 00 00 00 00 ff 03 00 00
40: 00 00 00 00 00 00 00 00 09 50 08 00 f1 14 10 04
50: 01 64 03 c8 0b 01 00 00 00 00 00 00 00 00 00 00
60: 00 00 00 00 10 a0 02 00 a1 8f 00 00 30 29 00 00
70: 03 0d 40 00 40 00 03 11 00 00 00 00 00 00 00 00
80: 00 00 00 00 00 00 00 00 00 08 70 00 00 00 00 00
90: 0e 00 00 00 00 00 01 00 00 00 00 00 00 00 00 00
a0: 05 00 81 00 00 00 e0 fe 00 00 00 00 00 00 00 00
b0: 00 00 00 00 00 00 00 00 00 00 00 00 00 00 00 00
c0: 00 00 00 00 00 00 00 00 00 00 00 00 00 00 00 00
d0: 00 00 00 00 00 00 00 00 00 00 00 00 00 00 00 00
e0: 00 00 00 00 00 00 00 00 00 00 00 00 00 00 00 00
f0: 00 00 00 00 00 00 00 00 00 00 00 00 00 00 00 00

0000:05:00.0 SATA controller: Advanced Micro Devices, Inc. [AMD] FCH SATA Controller [AHCI mode] (rev 61)
00: 22 10 01 79 07 04 10 00 61 01 06 01 10 00 00 00
10: 00 00 00 00 00 00 00 00 00 00 00 00 00 00 00 00
20: 00 00 00 00 00 00 c0 fc 00 00 00 00 22 10 01 79
30: 00 00 00 00 48 00 00 00 00 00 00 00 ff 01 00 00
40: 00 00 00 00 00 00 00 00 09 50 08 00 22 10 01 79
50: 01 64 23 c0 00 00 00 00 00 00 00 00 00 00 00 00
60: 00 00 00 00 10 a0 02 00 a1 8f 00 00 3f 29 09 00
70: 03 0d 40 00 40 00 03 11 00 00 00 00 00 00 00 00
80: 00 00 00 00 00 00 00 00 00 00 00 00 00 00 00 00
90: 0e 00 00 00 03 00 1f 00 00 00 00 00 00 00 00 00
a0: 05 d0 83 00 00 00 e0 fe 00 00 00 00 00 00 00 00
b0: 00 00 00 00 00 00 00 00 00 00 00 00 00 00 00 00
c0: 00 00 00 00 00 00 00 00 00 00 00 00 00 00 00 00
d0: 12 00 10 00 0f 00 00 00 00 00 00 00 00 ff 37 f7
e0: 00 00 00 00 00 00 00 00 00 00 00 00 00 00 00 00
f0: 00 00 00 00 00 00 00 00 00 00 00 00 00 00 00 00

# exit 0
